{
  "$schema": "https://json-schema.org/draft/2020-12/schema",
  "title": "Festivals",
  "type": "array",
  "items": {
    "type": "object",
    "additionalProperties": false,
    "required": ["id", "organizerId", "title", "startDate", "endDate", "city"],
    "properties": {
      "id": { "type": "string", "pattern": "^[a-z0-9]+(-[a-z0-9]+)*$" },
      "organizerId": { "type": "string", "minLength": 1 },
      "title": { "type": "string", "minLength": 1 },
      "startDate": { "type": "string", "format": "date" },
      "endDate": { "type": "string", "format": "date" },
      "city": { "type": "string", "minLength": 1 },
      "description": { "type": "string", "minLength": 1 },
      "website": { "type": "string", "format": "uri", "pattern": "^https?://" }
    }
  }
}
