[
  {
    "id": "photoszene-festival-2027",
    "organizerId": "photoszene-koeln",
    "title": "Photoszene-Festival 2027",
    "startDate": "2027-05-14",
    "endDate": "2027-06-13",
    "city": "Köln",
    "description": "Das Festival der Internationalen Photoszene Köln.",
    "website": "https://www.photoszene.de/de/festival/"
  }
]
